KEY,Venue,Topic Area/s 1,Topic Area/s 2,Type,Title,dblp URL
titb,TITB,other,,journal,IEEE Transactions on Information Technology in Biomedicine,
tkdd,TKDD,data mining,artificial intelligence,journal,ACM Transactions on Knowledge Discovery from Data,
tkde,TKDE,data mining,artificial intelligence,journal,IEEE Transactions on Knowledge & Data Engineering Promoting,
tmc,TMC,mobile,systems,journal,IEEE Transactions on Mobile Computing,
tmm,TMM,multimedia,,journal,IEEE Transactions on Multimedia,
tochi,TOCHI,human computer interaction,,journal,ACM Transactions on Computer-Human Interaction,
tocl,TOCL,theory,,journal,ACM Transactions on Computational Logic,
tocs,TOCS,systems,,journal,ACM Transactions on Computer Systems,
toct,TOCT,theory,,journal,ACM Transactions on Computation Theory,
todaes,TODAES,circuits,"architecture, systems",journal,ACM Transactions on Design Automation of Electronic Systems,
tods,TODS,databases,,journal,ACM Transactions on Database Systems,
tog,TOG,graphics,,journal,ACM Transactions on Graphics,
tois,TOIS,systems,,journal,ACM Transactions on Information Systems,
toit,TOIT,systems,,journal,ACM Transactions on Internet Technology,
tomacs,TOMACS,theory,performance analysis,journal,ACM Transactions on Modeling and Computer Simulation,
tomccap,TOMCCAP,multimedia,,journal,"ACM Transactions on Multimedia Computing, Communications, and Applications",
toms,TOMS,theory,,journal,ACM Transactions on Mathematical Software,
ton,TON,networks,systems,journal,IEEE/ACM Transactions on Networking,
toplas,TOPLAS,programming languages,systems,journal,ACM Transactions on Programming Languages and Systems,
tos,TOS,systems,,journal,ACM Transactions on Storage,
tosem,TOSEM,software engineering,,journal,ACM Transactions on Software Engineering and Methodology,
tosn,TOSN,networks,systems,journal,ACM Transactions on Sensor Networks,
tpds,TPDS,distributed systems,,journal,IEEE Transactions on Parallel & Distributed Systems,
trets,TRETS,systems,,journal,ACM Transactions on Reconfigurable Technology and Systems,
tse,TSE,software engineering,,journal,IEEE Transactions on Software Engineering,
tslp,TSLP,natural language processing,,journal,ACM Transactions on Speech and Language Processing,
tvcg,TVCG,graphics,,journal,IEEE Transactions on Visualization & Computer Graphics,
tvlsi,VLSI,circuits,"architecture, systems",journal,IEEE Transactions on Very Large Scale Integration (VLSI) Systems,
tweb,TWEB,web technologies,,journal,ACM Transactions on the Web,
uai,UAI,artificial intelligence,,conference,Conference on Uncertainty in Artificial Intelligence,
ubicomp,UBICOMP,human computer interaction,,conference,Ubiquitous Computing,
uist,UIST,human computer interaction,,conference,ACM Symposium on User Interface Software and Technology,
usenix,USENIX ATC,systems,operating systems,conference,USENIX Annual Technical Conference,
uss,USENIX Security,systems,security,conference,USENIX Security Symposium,
vee,VEE,systems,"operating systems, programming languages",conference,International Conference on Virtual Execution Environments,
vldb,VLDB,databases,,journal,International conference on Very large data bases,
vr,VR,artificial intelligence,vision,conference,IEEE Virtual Reality Conference,
wads,WADS,theory,algorithms,conference,Algorithms and Data Structures Symposium (was Workshop on Algorithms and Data Structures),
wcci,WCCI,artificial intelligence,,conference,World Congress on Computational Intelligence,
wimob,WiMOB,systems,"networks,mobile",conference,"IEEE International Conference on Wireless and Mobile Computing, Networking and Communications",
wowmom,WoWMoM,systems,"networks,mobile",conference,"IEEE International Symposium on a World of Wireless, Mobile and Multimedia Networks",
wsdm,WSDM,artificial intelligence,"databases, data mining",conference,ACM International Conference on Web Search and Data Mining,
www,WWW,web technologies,information retrieval,conference,International World Wide Web Conference,
